{
  "apiVersion": "acme-conductor.cits-nue.github.io/v1alpha1",
  "kind": "SignedCertificateReconcileResult",
  "protected": "eyJhbGciOiJFZERTQSIsImtpZCI6IjY1YjYwNjczZDZlZDg4NGIiLCJpc3N1ZWRBdCI6IjIwMjYtMDktMjJUMTI6MDA6MDBaIiwiZXhwaXJlc0F0IjoiMjAyNi0wOS0yMlQxMzowMDowMFoiLCJub25jZSI6IkFBQUFBQUFBQUFBQUFBQUFBQUFBQUEifQ",
  "payload": "eyJhcGlWZXJzaW9uIjoiYWNtZS1jb25kdWN0b3IuY2l0cy1udWUuZ2l0aHViLmlvL3YxYWxwaGExIiwia2luZCI6IkNlcnRpZmljYXRlUmVjb25jaWxlUmVzdWx0IiwicnVuSWQiOiIwMUpBQkNERUZHSEpLTU5QUVJTVFZXWFlaMCIsInRhcmdldElkIjoiMDFKQUJDREVGR0hKS01OUFFSU1RWV1hZWjEiLCJzdGF0dXMiOiJzdWNjZWVkZWQiLCJhY3Rpb24iOiJpc3N1ZWQiLCJleHBpcmVzQXQiOiIyMDI2LTEyLTE5VDAxOjAyOjAzWiIsImZpbmdlcnByaW50U2hhMjU2IjoiYWJhYmFiYWJhYmFiYWJhYmFiYWJhYmFiYWJhYmFiYWJhYmFiYWJhYmFiYWJhYmFiYWJhYmFiYWJhYmFiYWJhYiIsInN0b3JlT2JqZWN0UmVmIjoid2lraS1leGFtcGxlLWFjLWpwIiwic3RhcnRlZEF0IjoiMjAyNi0wOS0yMFQwMTowMjowM1oiLCJmaW5pc2hlZEF0IjoiMjAyNi0wOS0yMFQwMTowMzowM1oiLCJlcnJvciI6bnVsbH0",
  "signature": "DR33qmQ8ouMN8eMscS5kzNQyc7tQaGRtq24ATVBIowuQw1KWo21_EfCc3YhRJQVMIKr1Y5AfGK88yCHADQmBDA"
}
